{"contract":"usage-max.task.v1","taskId":"task-stage0-001","state":"paused_for_usage","createdAt":"2026-10-15T06:00:00Z","updatedAt":"2026-10-15T06:05:00Z","attempt":1,"idempotencyKey":"idem-stage0-001","provider":"openai","surface":"codex-cli","accountSlot":"openai-primary","checkpoint":{"version":2,"path":".usage-max/checkpoints/task-stage0-001.json","digest":"sha256-checkpoint-001"},"effects":[{"effectId":"effect-test-001","kind":"run-targeted-tests","state":"committed","resultDigest":"sha256-tests-001"}],"lease":null}
